{
  "artifact_type": "skill_validation_report",
  "skill_name": "plumber-xray-storyteller",
  "target_root": "skills/plumber-xray-storyteller",
  "status": "pass",
  "checks": {
    "frontmatter": true,
    "artifact_contract": true,
    "schemas": true,
    "templates": true,
    "protocol_compliance": true
  },
  "unsupported_command_audit": {
    "current_pi_execution_path_clean": true,
    "future_section_present": false,
    "findings": []
  },
  "artifact_contract_usage": {
    "write_finalize_validate_calls_include_contract": true,
    "patch_json_uses_supported_operations": true,
    "patch_json_omits_contract": true,
    "findings": []
  },
  "protocol_compliance": {
    "all_user_visible_slots_match_protocol": true,
    "slots_checked": ["diagnosis_plan", "narration_script", "voiceover", "storyboard", "final"],
    "findings": []
  },
  "layout_plan_cross_check": {
    "ran": true,
    "ok": true,
    "findings": [],
    "note": "_design/skill_structure.json 存在；artifact_layout_plan[] 与 5 个 slot schema 的 layout_type / component_type / card_variant / is_segment↔detail.variant const 全部一致。"
  },
  "terminal_source_package_promoted": true,
  "issues": [],
  "warnings": [],
  "validated_at": "2026-05-14T07:42:17.000Z"
}
